<!--                                                              -->
<!-- GROMACS Data type description (DTD). 

                This source code is part of
 
                 G   R   O   M   A   C   S
 
          GROningen MAchine for Chemical Simulations
 
                        VERSION 3.1
 
 Copyright (c) 1991-2002
 BIOSON Research Institute, Dept. of Biophysical Chemistry
 University of Groningen, The Netherlands
 
 This program is free software; you can redistribute it and/or
 modify it under the terms of the GNU General Public License
 as published by the Free Software Foundation; either version 2
 of the License, or (at your option) any later version.
 
 If you want to redistribute modifications, please consider that
 scientific software is very special. Version control is crucial -
 bugs must be traceable. We will be happy to consider code for
 inclusion in the official distribution, but derived work must not
 be called official GROMACS. Details are found in the README & COPYING
 files - if they are missing, get the official version at www.gromacs.org.
 
 To help us fund GROMACS development, we humbly ask that you cite
 the papers on the package - you can find them in the top README file.
 
 Do check out http://www.gromacs.org , or mail us at gromacs@gromacs.org .
 
 And Hey:
 GROningen Mixture of Alchemy and Childrens' Stories

 $Id$      
                                                            
 David van der Spoel 07/2001, 03/2002                        
 The authorative version of this document can be found at    
 http://www.gromacs.org/gromacs3.1.dtd                       
 and also in the library directory of your local GROMACS     
 installation.                                                
 
 Please use the following formal public identifier to identify it:
     "-//GROMACS//DTD Gromacs XML V1.0//EN"

 <!DOCTYPE gromacs PUBLIC "-//GROMACS//DTD Gromacs XML V3.1.0//EN"
                   "http://www.gromacs.org/gromacs3.1.dtd"
                   [...]>
-->

<!ELEMENT residues (residue*,linkdef*,moddef*)>

<!ELEMENT residue (ratom+,rbond+)>
<!ATTLIST residue
          restype ID #REQUIRED>
<!-- We can not use ID here for atom names since there is no -->
<!-- hope to make them unique, e.g. all amino acids have the -->
<!-- same name for backbone atoms.                           -->
<!ELEMENT ratom EMPTY>
<!ATTLIST ratom
          name  CDATA #REQUIRED>
<!ELEMENT rbond EMPTY>
<!ATTLIST rbond
          a1 CDATA #REQUIRED
	  a2 CDATA #REQUIRED>	  

<!-- Define a covalent link between two residues (prev and next) -->
<!ELEMENT linkdef EMPTY>
<!ATTLIST linkdef
          linktype ID    #REQUIRED
	  atomprev CDATA #REQUIRED
          atomnext CDATA #REQUIRED>

<!-- Description of termini, etc. or maybe other modifications too -->
<!-- It is important that the implementation deletes first, and    -->
<!-- adds atoms afterwards                                         --> 
<!ELEMENT moddef (moddelete*,modadd*)>
<!ATTLIST moddef
          modtype ID    #REQUIRED>
<!ELEMENT moddelete EMPTY>
<!ATTLIST moddelete
          delname CDATA #REQUIRED>
<!ELEMENT modadd EMPTY>
<!ATTLIST modadd
          addname CDATA #REQUIRED
          addbond CDATA #REQUIRED>
